<?xml version="1.0"?>

<root xmlns="https://www.w3schools.com"
	  xmlns:xsi="http://www.w3.org/2001/XMLSchema-instance"
	  xsi:schemaLocation="https://raw.githubusercontent.com/himalayahall/DATA607/main/Assignment%208/books.xsd">

		<books:book>
			<books:title>Thinking Fast and Slow</books:title>
			<books:author>Daniel Kahneman</books:author>
			<books:medium>Paperback</books:medium>
			<books:pages>499</books:pages>
			<books:pisbn>0374533555</books:pisbn>
		</books:book>

		<books:book>
			<books:title>Wolf Hall</books:title>
			<books:author>Hilary Mantel</books:author>
			<books:medium>Paperback</books:medium>
			<books:pages>640</books:pages>
			<books:pisbn>1250806712</books:pisbn>
		</books:book>

		<books:book>
			<books:title>Man-Eaters of Kumaon</books:title>
			<books:author>Jim Corbett</books:author>
			<books:medium>Paperback</books:medium>
			<books:pages>184</books:pages>
			<books:pisbn>8129140365</books:pisbn>
		</books:book>		

</root>